{
 "name": "raw-arguments-key-domain",
 "family": "agent",
 "authority": "pinned Pi b7bb00b9 ai/src/utils/json-parse.ts parseJsonWithRepair (sliced) + agent-loop.ts prepareToolCall/executePreparedToolCall/finalizeExecutedToolCall (sliced; a tool without prepareArguments) + validation.ts validateToolArguments (typebox 1.3.7), under Node 22.15.1 (L0206-D002 raw-boundary probe)",
 "pi_revision": "b7bb00b936dbe21b8e160b3e89efdec361846699",
 "requirements": [
  "AI-003"
 ],
 "witnesses": [
  "raw_tool_call_argument_value_domain"
 ],
 "notes": "Raw object keys share the string domain: keys holding an unpaired low, an unpaired high and a valid pair keep their exact code units. Enumeration ORDER is L0206-D001's (K1) and is not asserted here. GENERATED from the pinned-Pi raw-boundary probe; regenerate with harness/make_scenarios.py.",
 "raw_arguments": {
  "cases": [
   {
    "id": "keys/surrogate-keys",
    "provider_text": "{\"\\udc00\":1,\"\\ud800\":2,\"\\ud83d\\ude00\":3,\"a\":4}",
    "arguments": {
     "$keys": [
      [
       [
        56320
       ],
       {
        "number": "1"
       }
      ],
      [
       [
        55296
       ],
       {
        "number": "2"
       }
      ],
      [
       [
        55357,
        56832
       ],
       {
        "number": "3"
       }
      ],
      [
       [
        97
       ],
       {
        "number": "4"
       }
      ]
     ]
    }
   }
  ]
 }
}
