{
 "name": "raw-arguments-number-domain",
 "family": "agent",
 "authority": "pinned Pi b7bb00b9 ai/src/utils/json-parse.ts parseJsonWithRepair (sliced) + agent-loop.ts prepareToolCall/executePreparedToolCall/finalizeExecutedToolCall (sliced; a tool without prepareArguments) + validation.ts validateToolArguments (typebox 1.3.7), under Node 22.15.1 (L0206-D002 raw-boundary probe)",
 "pi_revision": "b7bb00b936dbe21b8e160b3e89efdec361846699",
 "requirements": [
  "AI-003"
 ],
 "witnesses": [
  "raw_tool_call_argument_value_domain"
 ],
 "notes": "Raw number leaves (decision section 6): pinned Pi's JSON.parse yields runtime numbers -- -0 (also from -1e-400), +/-Infinity from overflow, binary64 rounding (9007199254740993 -> 9007199254740992), the smallest subnormal and the largest finite -- and carries them live to tool_execution_start, beforeToolCall and execute. (Pi's persisted session line projects -0 -> 0 and +/-Infinity -> null; Minion's certified Layer 03 has no persisted byte form, so the log keeps and replays the live value.) GENERATED from the pinned-Pi raw-boundary probe; regenerate with harness/make_scenarios.py.",
 "raw_arguments": {
  "cases": [
   {
    "id": "number/large-finite",
    "provider_text": "{\"n\":1.7976931348623157e308}",
    "arguments": {
     "n": {
      "number": "1.7976931348623157e+308"
     }
    }
   },
   {
    "id": "number/integer-2p53-plus-1",
    "provider_text": "{\"n\":9007199254740993}",
    "arguments": {
     "n": {
      "number": "9007199254740992"
     }
    }
   },
   {
    "id": "number/negative-zero",
    "provider_text": "{\"n\":-0}",
    "arguments": {
     "n": {
      "number": "-0"
     }
    }
   },
   {
    "id": "number/zero",
    "provider_text": "{\"n\":0}",
    "arguments": {
     "n": {
      "number": "0"
     }
    }
   },
   {
    "id": "number/overflow-positive",
    "provider_text": "{\"n\":1e999}",
    "arguments": {
     "n": {
      "number": "+Infinity"
     }
    }
   },
   {
    "id": "number/overflow-negative",
    "provider_text": "{\"n\":-1e999}",
    "arguments": {
     "n": {
      "number": "-Infinity"
     }
    }
   },
   {
    "id": "number/overflow-400-digits",
    "provider_text": "{\"n\":9999999999999999999999999999999999999999999999999999999999999999999999999999999999999999999999999999999999999999999999999999999999999999999999999999999999999999999999999999999999999999999999999999999999999999999999999999999999999999999999999999999999999999999999999999999999999999999999999999999999999999999999999999999999999999999999999999999999999999999999999999999999999999999999999999999999999999}",
    "arguments": {
     "n": {
      "number": "+Infinity"
     }
    }
   },
   {
    "id": "number/underflow-to-zero",
    "provider_text": "{\"n\":1e-400}",
    "arguments": {
     "n": {
      "number": "0"
     }
    }
   },
   {
    "id": "number/negative-underflow",
    "provider_text": "{\"n\":-1e-400}",
    "arguments": {
     "n": {
      "number": "-0"
     }
    }
   },
   {
    "id": "number/smallest-subnormal",
    "provider_text": "{\"n\":5e-324}",
    "arguments": {
     "n": {
      "number": "5e-324"
     }
    }
   }
  ]
 }
}
